<?xml version="1.0" encoding="UTF-8" standalone="yes"?>
<productsData xmlns:xsi="http://www.w3.org/2001/XMLSchema-instance" xsi:noNamespaceSchemaLocation="ProductData.xsd">
    <categories>
        <category>
            <categoryname>CATEGORY 1</categoryname>
            <subcategories>
                <subcategory>
                    <products>
                        <product Color="black">
                            <dateOfManufacture>01-11-2017</dateOfManufacture>
                            <model>AA123</model>
                            <price>200.0</price>
                            <producer>Apple</producer>
                            <quantity>3.0</quantity>
                        </product>
                        <product Color="gold">
                            <dateOfManufacture>01-11-2018</dateOfManufacture>
                            <model>BB345</model>
                            <price>300.0</price>
                            <producer>Apple</producer>
                            <quantity>4.0</quantity>
                        </product>
                    </products>
                    <subcategoryname>SUBCATEGORY 1</subcategoryname>
                </subcategory>
                <subcategory>
                    <products>
                        <product Color="gray">
                            <dateOfManufacture>01-11-2019</dateOfManufacture>
                            <model>CC789</model>
                            <price>500.0</price>
                            <producer>Apple</producer>
                            <quantity>5.0</quantity>
                        </product>
                    </products>
                    <subcategoryname>SUBCATEGORY 2</subcategoryname>
                </subcategory>
            </subcategories>
        </category>
        <category>
            <categoryname>CATEGORY 2</categoryname>
            <subcategories>
                <subcategory>
                    <products>
                        <product Color="black">
                            <dateOfManufacture>01-11-2017</dateOfManufacture>
                            <model>AA123</model>
                            <price>200.0</price>
                            <producer>Apple</producer>
                            <quantity>3.0</quantity>
                        </product>
                        <product Color="gold">
                            <dateOfManufacture>01-11-2018</dateOfManufacture>
                            <model>BB345</model>
                            <price>300.0</price>
                            <producer>Apple</producer>
                            <quantity>4.0</quantity>
                        </product>
                    </products>
                    <subcategoryname>SUBCATEGORY 1</subcategoryname>
                </subcategory>
                <subcategory>
                    <products>
                        <product Color="gray">
                            <dateOfManufacture>01-11-2019</dateOfManufacture>
                            <model>CC789</model>
                            <price>500.0</price>
                            <producer>Apple</producer>
                            <quantity>5.0</quantity>
                        </product>
                    </products>
                    <subcategoryname>SUBCATEGORY 2</subcategoryname>
                </subcategory>
            </subcategories>
        </category>
    </categories>
</productsData>
